{
  "schema_version": "erp-agent-context/v1",
  "task_id": "AGENT-R1-5",
  "task_packet_revision": 2,
  "agent_id": "adversarial-r1-5",
  "instance_id": "adversarial-r1-5-native2",
  "role": "ADVERSARIAL_EXAMINER",
  "capability_profile": "ADVERSARIAL_READ_ONLY",
  "candidate_sha": "6bf2b1faf205e64b1505779f211fb88d6c60696b",
  "lease_generation": 1,
  "visibility": "SYNTHETIC_PROTOCOL_ONLY",
  "documents": [
    {
      "locator": "git://6bf2b1faf205e64b1505779f211fb88d6c60696b/docs/tasks/AGENT-R1-5.md",
      "digest": "sha256:529216694ce3bba396b0b0b94f81143f22a54364e129bc6e56474e2af87c7ac5",
      "classification": "SYNTHETIC_CONTRACT"
    },
    {
      "locator": "git://6bf2b1faf205e64b1505779f211fb88d6c60696b/docs/agent-control/schemas/message-v1.schema.json",
      "digest": "sha256:050254efd72847554fd46d35748bb1fe6d0839ffbdd25a15b4fa6e2f668bf69a",
      "classification": "SYNTHETIC_CONTRACT"
    },
    {
      "locator": "git://6bf2b1faf205e64b1505779f211fb88d6c60696b/docs/agent-control/schemas/context-manifest-v1.schema.json",
      "digest": "sha256:13d219f93f16cbf5f725b45900d8959fab3df5785613565de5ced0ab12980e98",
      "classification": "SYNTHETIC_CONTRACT"
    },
    {
      "locator": "git://6bf2b1faf205e64b1505779f211fb88d6c60696b/docs/agent-control/pilots/AGENT-R1-5/valid-bundle.json",
      "digest": "sha256:41155ecc69239ef7966daa4b8a44053004c7a700cc7da983f5ddbc7632af04d1",
      "classification": "SYNTHETIC_CONTRACT"
    },
    {
      "locator": "git://6bf2b1faf205e64b1505779f211fb88d6c60696b/tools/erp_agent_control/native_mvp.py",
      "digest": "sha256:26bcd89f6e01be88e5b47210978d5ed7e662488bb5a1661c672f6525e6d26711",
      "classification": "SYNTHETIC_CANDIDATE"
    },
    {
      "locator": "git://6bf2b1faf205e64b1505779f211fb88d6c60696b/tools/erp_agent_control/tests/test_native_mvp.py",
      "digest": "sha256:5178ab797be175275ca23daba441f247e119967b7346b0bccfb0e58755132c19",
      "classification": "SYNTHETIC_TEST_EVIDENCE"
    }
  ],
  "forbidden_context": [
    "OWNER_UNTRACKED_INPUT",
    "PRODUCT_SOURCE",
    "GIT_INTERNALS",
    "REAL_BUSINESS_DATA",
    "SECRETS",
    "UAT_OR_PRODUCTION"
  ],
  "manifest_digest": "sha256:159eb09fd62f2b63664391524679d9b42b7c22261ea7c6b3fa6947cb129ede91"
}
