{
  "schema_version": "erp-agent-context/v1",
  "task_id": "AGENT-R1-5",
  "task_packet_revision": 2,
  "agent_id": "qa-r1-5",
  "instance_id": "qa-r1-5-native9",
  "role": "INDEPENDENT_VERIFIER",
  "capability_profile": "QA_TEST_READ_ONLY",
  "candidate_sha": "2ac5ac5b1e400c095e5ee5152469f37be9de1a91",
  "lease_generation": 1,
  "visibility": "SYNTHETIC_PROTOCOL_ONLY",
  "documents": [
    {
      "locator": "git://2ac5ac5b1e400c095e5ee5152469f37be9de1a91/docs/tasks/AGENT-R1-5.md",
      "digest": "sha256:529216694ce3bba396b0b0b94f81143f22a54364e129bc6e56474e2af87c7ac5",
      "classification": "SYNTHETIC_CONTRACT"
    },
    {
      "locator": "git://2ac5ac5b1e400c095e5ee5152469f37be9de1a91/docs/agent-control/task-packets/AGENT-R1-5.json",
      "digest": "sha256:8f670f7099deec1cbbae7b0f145864e7c299f5e200223856f52ff119ff14edda",
      "classification": "SYNTHETIC_CONTRACT"
    },
    {
      "locator": "git://2ac5ac5b1e400c095e5ee5152469f37be9de1a91/docs/agent-control/schemas/task-packet-v2.schema.json",
      "digest": "sha256:74037d60179b2b8eef811ddee700656a53d2844b64cb33d9bb2d414c67ecd05c",
      "classification": "SYNTHETIC_CONTRACT"
    },
    {
      "locator": "git://2ac5ac5b1e400c095e5ee5152469f37be9de1a91/docs/agent-control/schemas/message-v1.schema.json",
      "digest": "sha256:462d550a26a34e0559bf726ea980e7d2dcf6c3a6b2cfceebe4027d1fcf8fb28c",
      "classification": "SYNTHETIC_CONTRACT"
    },
    {
      "locator": "git://2ac5ac5b1e400c095e5ee5152469f37be9de1a91/docs/agent-control/schemas/context-manifest-v1.schema.json",
      "digest": "sha256:81a455b0357b4a4c520894d3fbf5f55c6919cad6d30850474d44dd3f145f7672",
      "classification": "SYNTHETIC_CONTRACT"
    },
    {
      "locator": "git://2ac5ac5b1e400c095e5ee5152469f37be9de1a91/docs/agent-control/pilots/AGENT-R1-5/valid-bundle.json",
      "digest": "sha256:481cc4e1ff15128dedb6eb86af3408285e3f76a19e8faad2e5989897262e8659",
      "classification": "SYNTHETIC_TEST_EVIDENCE"
    },
    {
      "locator": "git://2ac5ac5b1e400c095e5ee5152469f37be9de1a91/docs/agent-control/pilots/AGENT-R1-5/blackbox/README.md",
      "digest": "sha256:04d15e6eb37e83773d33932e323b1340988ff9e4848e514bd18eef3598164609",
      "classification": "SYNTHETIC_CONTRACT"
    },
    {
      "locator": "git://2ac5ac5b1e400c095e5ee5152469f37be9de1a91/docs/agent-control/pilots/AGENT-R1-5/blackbox/interface.json",
      "digest": "sha256:e0668945eb3234545adbfa425d7b23adee2b120e777ba56d09e20f000cc7d87b",
      "classification": "SYNTHETIC_TEST_EVIDENCE"
    },
    {
      "locator": "git://2ac5ac5b1e400c095e5ee5152469f37be9de1a91/docs/agent-control/pilots/AGENT-R1-5/blackbox/personas.json",
      "digest": "sha256:23729b61eef1f91de0f0523465a855877a3bdd4973e1bed78733a9534985ed0b",
      "classification": "SYNTHETIC_TEST_EVIDENCE"
    },
    {
      "locator": "git://2ac5ac5b1e400c095e5ee5152469f37be9de1a91/docs/agent-control/pilots/AGENT-R1-5/blackbox/observed-report.json",
      "digest": "sha256:351a824a1c4ed4d53f35e9c3c80f90a6756e79cc3867206b6f6360697e5e577c",
      "classification": "SYNTHETIC_TEST_EVIDENCE"
    },
    {
      "locator": "git://2ac5ac5b1e400c095e5ee5152469f37be9de1a91/docs/agent-control/pilots/AGENT-R1-5/blackbox/runner.mjs",
      "digest": "sha256:04a352d1cd55cbb667b5f431857d23f8d4bf51416758b67955ec08f28221efbe",
      "classification": "SYNTHETIC_TEST_EVIDENCE"
    },
    {
      "locator": "git://2ac5ac5b1e400c095e5ee5152469f37be9de1a91/tools/erp_agent_control/native_mvp.py",
      "digest": "sha256:0baebde919852c72096efa905fbe9f889d6b2b40c337bd7e055b3c6dfee108fa",
      "classification": "SYNTHETIC_CANDIDATE"
    },
    {
      "locator": "git://2ac5ac5b1e400c095e5ee5152469f37be9de1a91/tools/erp_agent_control/readonly_controller.py",
      "digest": "sha256:1d54b6a69d451ea5d753072216b8233b1d30beba3fde4afdcceb9e2adf58c64d",
      "classification": "SYNTHETIC_CANDIDATE"
    },
    {
      "locator": "git://2ac5ac5b1e400c095e5ee5152469f37be9de1a91/tools/erp_agent_control/pilot_fixture.py",
      "digest": "sha256:be3504cef28d32d8884208351735430250eeb0ed0b5e4a87c6882f90b170aab9",
      "classification": "SYNTHETIC_CANDIDATE"
    },
    {
      "locator": "git://2ac5ac5b1e400c095e5ee5152469f37be9de1a91/tools/erp_agent_control/tests/test_native_mvp.py",
      "digest": "sha256:b4c904e26cebe05827dcde3d64d1c3de4d381ec500a9eb078e2e330ef1c32bca",
      "classification": "SYNTHETIC_TEST_EVIDENCE"
    },
    {
      "locator": "git://2ac5ac5b1e400c095e5ee5152469f37be9de1a91/tools/erp_agent_control/tests/test_readonly_controller.py",
      "digest": "sha256:6c0094603887ad6b23e09b6030d8a9c2c212711c872204dae39cb586115bc273",
      "classification": "SYNTHETIC_TEST_EVIDENCE"
    },
    {
      "locator": "git://1f55696b124c899d49f4505c9ad0cd238d910b24..2ac5ac5b1e400c095e5ee5152469f37be9de1a91?operation=diff-name-only",
      "digest": "sha256:468edd5591e2311b3efad4dcf6a742b40d1f580551b226ffb4a641e8b6464579",
      "classification": "SYNTHETIC_TEST_EVIDENCE"
    }
  ],
  "forbidden_context": [
    "OWNER_UNTRACKED_INPUT",
    "PRODUCT_SOURCE",
    "GIT_INTERNALS",
    "REAL_BUSINESS_DATA",
    "SECRETS",
    "UAT_OR_PRODUCTION"
  ],
  "manifest_digest": "sha256:626f0f70092cc96aa2d2494694aa5f034a03aa1cab8d5ab4e78aec8d377947d9"
}
