{
  "schema_version": "erp-agent-context/v1",
  "task_id": "AGENT-R1-5",
  "task_packet_revision": 2,
  "agent_id": "security-r1-5",
  "instance_id": "security-r1-5-native4",
  "role": "SECURITY_BOUNDARY_EXAMINER",
  "capability_profile": "SECURITY_READ_ONLY",
  "candidate_sha": "6bf2b1faf205e64b1505779f211fb88d6c60696b",
  "lease_generation": 1,
  "visibility": "SYNTHETIC_PROTOCOL_ONLY",
  "documents": [
    {
      "locator": "git://6bf2b1faf205e64b1505779f211fb88d6c60696b/docs/tasks/AGENT-R1-5.md",
      "digest": "sha256:529216694ce3bba396b0b0b94f81143f22a54364e129bc6e56474e2af87c7ac5",
      "classification": "SYNTHETIC_CONTRACT"
    },
    {
      "locator": "git://6bf2b1faf205e64b1505779f211fb88d6c60696b/docs/agent-control/schemas/task-packet-v2.schema.json",
      "digest": "sha256:ece051dfff89d7e4857a950e2832c2e8dad79b24b4405758e0ab35486ea7313d",
      "classification": "SYNTHETIC_CONTRACT"
    },
    {
      "locator": "git://6bf2b1faf205e64b1505779f211fb88d6c60696b/docs/agent-control/schemas/message-v1.schema.json",
      "digest": "sha256:050254efd72847554fd46d35748bb1fe6d0839ffbdd25a15b4fa6e2f668bf69a",
      "classification": "SYNTHETIC_CONTRACT"
    },
    {
      "locator": "git://6bf2b1faf205e64b1505779f211fb88d6c60696b/docs/agent-control/schemas/context-manifest-v1.schema.json",
      "digest": "sha256:13d219f93f16cbf5f725b45900d8959fab3df5785613565de5ced0ab12980e98",
      "classification": "SYNTHETIC_CONTRACT"
    },
    {
      "locator": "git://6bf2b1faf205e64b1505779f211fb88d6c60696b/tools/erp_agent_control/native_mvp.py",
      "digest": "sha256:26bcd89f6e01be88e5b47210978d5ed7e662488bb5a1661c672f6525e6d26711",
      "classification": "SYNTHETIC_CANDIDATE"
    },
    {
      "locator": "git://6bf2b1faf205e64b1505779f211fb88d6c60696b/tools/erp_agent_control/readonly_controller.py",
      "digest": "sha256:7d8891643f985efd6cd79467732529c9ab5db7781f081db4f82d0a7efd6f64ed",
      "classification": "SYNTHETIC_CANDIDATE"
    },
    {
      "locator": "git://6bf2b1faf205e64b1505779f211fb88d6c60696b/tools/erp_agent_control/tests/test_native_mvp.py",
      "digest": "sha256:5178ab797be175275ca23daba441f247e119967b7346b0bccfb0e58755132c19",
      "classification": "SYNTHETIC_TEST_EVIDENCE"
    },
    {
      "locator": "git://6bf2b1faf205e64b1505779f211fb88d6c60696b/tools/erp_agent_control/tests/test_readonly_controller.py",
      "digest": "sha256:2437459607b1e4a5d303009439e90b404c3be1d668dabf1d6016c853f48a7fdd",
      "classification": "SYNTHETIC_TEST_EVIDENCE"
    }
  ],
  "forbidden_context": [
    "OWNER_UNTRACKED_INPUT",
    "PRODUCT_SOURCE",
    "GIT_INTERNALS",
    "REAL_BUSINESS_DATA",
    "SECRETS",
    "UAT_OR_PRODUCTION"
  ],
  "manifest_digest": "sha256:d3ea569343050446d00bfbffc58ec4a9d38259a38dacff7bb1e38c12ef90dcea"
}
