{
  "schema_version": "erp-agent-context/v1",
  "task_id": "AGENT-R1-5",
  "task_packet_revision": 2,
  "agent_id": "erp-guardian-r1-5",
  "instance_id": "erp-guardian-r1-5-native2",
  "role": "ERP_CONTRACT_GUARDIAN",
  "capability_profile": "ERP_READ_ONLY",
  "candidate_sha": "d68ae7488135a715818578a0179a91a6d43e67bd",
  "lease_generation": 1,
  "visibility": "SYNTHETIC_PROTOCOL_ONLY",
  "documents": [
    {
      "locator": "git://d68ae7488135a715818578a0179a91a6d43e67bd/docs/tasks/AGENT-R1-5.md",
      "digest": "sha256:529216694ce3bba396b0b0b94f81143f22a54364e129bc6e56474e2af87c7ac5",
      "classification": "SYNTHETIC_CONTRACT"
    },
    {
      "locator": "git://d68ae7488135a715818578a0179a91a6d43e67bd/docs/agent-control/task-packets/AGENT-R1-5.json",
      "digest": "sha256:8f670f7099deec1cbbae7b0f145864e7c299f5e200223856f52ff119ff14edda",
      "classification": "SYNTHETIC_CONTRACT"
    },
    {
      "locator": "git://d68ae7488135a715818578a0179a91a6d43e67bd/docs/ai-engineering/ERP_DOMAIN_BOUNDARIES.md",
      "digest": "sha256:c8a89a9d68bbee633b14c1fcd5f8a30d479c5d99532a3b4c3c58b59a67183504",
      "classification": "SYNTHETIC_CONTRACT"
    },
    {
      "locator": "git://d68ae7488135a715818578a0179a91a6d43e67bd/tools/erp_agent_control/native_mvp.py",
      "digest": "sha256:7a771ab1b81adb2cbcbd88fe2330cd3c26eb78720d0c094d9acde39764074c9b",
      "classification": "SYNTHETIC_CANDIDATE"
    },
    {
      "locator": "git://d68ae7488135a715818578a0179a91a6d43e67bd/tools/erp_agent_control/tests/test_native_mvp.py",
      "digest": "sha256:7b2332c55ceb507688335ebbcf2a822e048be7fd28d47a0ebd23d1a6af91f652",
      "classification": "SYNTHETIC_TEST_EVIDENCE"
    }
  ],
  "forbidden_context": [
    "OWNER_UNTRACKED_INPUT",
    "PRODUCT_SOURCE",
    "GIT_INTERNALS",
    "REAL_BUSINESS_DATA",
    "SECRETS",
    "UAT_OR_PRODUCTION"
  ],
  "manifest_digest": "sha256:16afb37173e59b4296509dbe626f1424824dc1f77d04684e1dad5d259aa32ed8"
}
