{
  "schema_version": "erp-agent-context/v1",
  "task_id": "AGENT-R1-5",
  "task_packet_revision": 2,
  "agent_id": "erp-guardian-r1-5",
  "instance_id": "erp-guardian-r1-5-native4",
  "role": "ERP_CONTRACT_GUARDIAN",
  "capability_profile": "ERP_READ_ONLY",
  "candidate_sha": "3d395cc881784a78ff45841dacc1e8d48c805f0c",
  "lease_generation": 1,
  "visibility": "SYNTHETIC_PROTOCOL_ONLY",
  "documents": [
    {
      "locator": "git://3d395cc881784a78ff45841dacc1e8d48c805f0c/docs/tasks/AGENT-R1-5.md",
      "digest": "sha256:529216694ce3bba396b0b0b94f81143f22a54364e129bc6e56474e2af87c7ac5",
      "classification": "SYNTHETIC_CONTRACT"
    },
    {
      "locator": "git://3d395cc881784a78ff45841dacc1e8d48c805f0c/docs/agent-control/task-packets/AGENT-R1-5.json",
      "digest": "sha256:8f670f7099deec1cbbae7b0f145864e7c299f5e200223856f52ff119ff14edda",
      "classification": "SYNTHETIC_CONTRACT"
    },
    {
      "locator": "git://3d395cc881784a78ff45841dacc1e8d48c805f0c/docs/ai-engineering/ERP_DOMAIN_BOUNDARIES.md",
      "digest": "sha256:c8a89a9d68bbee633b14c1fcd5f8a30d479c5d99532a3b4c3c58b59a67183504",
      "classification": "SYNTHETIC_CONTRACT"
    },
    {
      "locator": "git://3d395cc881784a78ff45841dacc1e8d48c805f0c/tools/erp_agent_control/native_mvp.py",
      "digest": "sha256:0f30b9ff66edb240e63b276fac28d67537c1b746f7559dee6c50358edff7f693",
      "classification": "SYNTHETIC_CANDIDATE"
    },
    {
      "locator": "git://3d395cc881784a78ff45841dacc1e8d48c805f0c/tools/erp_agent_control/tests/test_native_mvp.py",
      "digest": "sha256:7c74033b28ed13d0a62069e02a1e3abef737d3fd8beed8c3da1ad7cfcd3ea619",
      "classification": "SYNTHETIC_TEST_EVIDENCE"
    }
  ],
  "forbidden_context": [
    "OWNER_UNTRACKED_INPUT",
    "PRODUCT_SOURCE",
    "GIT_INTERNALS",
    "REAL_BUSINESS_DATA",
    "SECRETS",
    "UAT_OR_PRODUCTION"
  ],
  "manifest_digest": "sha256:806a4afb401b690930ae43923f49637b63eabb0a6fa25892654dba836fbcd646"
}
