{
  "schema_version": "erp-agent-context/v1",
  "task_id": "AGENT-R1-5",
  "task_packet_revision": 2,
  "agent_id": "adversarial-r1-5",
  "instance_id": "adversarial-r1-5-native6",
  "role": "ADVERSARIAL_EXAMINER",
  "capability_profile": "ADVERSARIAL_READ_ONLY",
  "candidate_sha": "2843b3df8eeff05584a2b492ff028ca812674164",
  "lease_generation": 1,
  "visibility": "SYNTHETIC_PROTOCOL_ONLY",
  "documents": [
    {
      "locator": "git://2843b3df8eeff05584a2b492ff028ca812674164/docs/tasks/AGENT-R1-5.md",
      "digest": "sha256:529216694ce3bba396b0b0b94f81143f22a54364e129bc6e56474e2af87c7ac5",
      "classification": "SYNTHETIC_CONTRACT"
    },
    {
      "locator": "git://2843b3df8eeff05584a2b492ff028ca812674164/docs/agent-control/schemas/message-v1.schema.json",
      "digest": "sha256:fd89cc0dd5fd8c9151da05a2f95d1585e258e17324ccb6de06333c007b605247",
      "classification": "SYNTHETIC_CONTRACT"
    },
    {
      "locator": "git://2843b3df8eeff05584a2b492ff028ca812674164/docs/agent-control/schemas/context-manifest-v1.schema.json",
      "digest": "sha256:81a455b0357b4a4c520894d3fbf5f55c6919cad6d30850474d44dd3f145f7672",
      "classification": "SYNTHETIC_CONTRACT"
    },
    {
      "locator": "git://2843b3df8eeff05584a2b492ff028ca812674164/docs/agent-control/pilots/AGENT-R1-5/valid-bundle.json",
      "digest": "sha256:41155ecc69239ef7966daa4b8a44053004c7a700cc7da983f5ddbc7632af04d1",
      "classification": "SYNTHETIC_CONTRACT"
    },
    {
      "locator": "git://2843b3df8eeff05584a2b492ff028ca812674164/tools/erp_agent_control/native_mvp.py",
      "digest": "sha256:ed9471f4299185d3966a523eab45b91f1dbc2e789f4776934b58af6cdbe9be97",
      "classification": "SYNTHETIC_CANDIDATE"
    },
    {
      "locator": "git://2843b3df8eeff05584a2b492ff028ca812674164/tools/erp_agent_control/tests/test_native_mvp.py",
      "digest": "sha256:dea966d05fb96d567a3164f89bf5ed48d5e7f226caaca2dbe2ff73d0a2074d86",
      "classification": "SYNTHETIC_TEST_EVIDENCE"
    }
  ],
  "forbidden_context": [
    "OWNER_UNTRACKED_INPUT",
    "PRODUCT_SOURCE",
    "GIT_INTERNALS",
    "REAL_BUSINESS_DATA",
    "SECRETS",
    "UAT_OR_PRODUCTION"
  ],
  "manifest_digest": "sha256:0fe820a089c1099f57f65b3a1e904bbbb2b25cbd185e665d5023099856ccdb58"
}
