{
  "schema_version": "erp-agent-context/v1",
  "task_id": "AGENT-R1-5",
  "task_packet_revision": 2,
  "agent_id": "security-r1-5",
  "instance_id": "security-r1-5-native3",
  "role": "SECURITY_BOUNDARY_EXAMINER",
  "capability_profile": "SECURITY_READ_ONLY",
  "candidate_sha": "d68ae7488135a715818578a0179a91a6d43e67bd",
  "lease_generation": 1,
  "visibility": "SYNTHETIC_PROTOCOL_ONLY",
  "documents": [
    {
      "locator": "git://d68ae7488135a715818578a0179a91a6d43e67bd/docs/tasks/AGENT-R1-5.md",
      "digest": "sha256:529216694ce3bba396b0b0b94f81143f22a54364e129bc6e56474e2af87c7ac5",
      "classification": "SYNTHETIC_CONTRACT"
    },
    {
      "locator": "git://d68ae7488135a715818578a0179a91a6d43e67bd/docs/agent-control/schemas/task-packet-v2.schema.json",
      "digest": "sha256:a67d7bdebc71596d00a78bd3260fc5cad1e31bd0986a009cbe74b474721879a9",
      "classification": "SYNTHETIC_CONTRACT"
    },
    {
      "locator": "git://d68ae7488135a715818578a0179a91a6d43e67bd/docs/agent-control/schemas/message-v1.schema.json",
      "digest": "sha256:e2441a1f608403ea5422ccfb382ded21bb2f2bc0c0eb99dd1b229f58dbae44a8",
      "classification": "SYNTHETIC_CONTRACT"
    },
    {
      "locator": "git://d68ae7488135a715818578a0179a91a6d43e67bd/docs/agent-control/schemas/context-manifest-v1.schema.json",
      "digest": "sha256:13d219f93f16cbf5f725b45900d8959fab3df5785613565de5ced0ab12980e98",
      "classification": "SYNTHETIC_CONTRACT"
    },
    {
      "locator": "git://d68ae7488135a715818578a0179a91a6d43e67bd/tools/erp_agent_control/native_mvp.py",
      "digest": "sha256:7a771ab1b81adb2cbcbd88fe2330cd3c26eb78720d0c094d9acde39764074c9b",
      "classification": "SYNTHETIC_CANDIDATE"
    },
    {
      "locator": "git://d68ae7488135a715818578a0179a91a6d43e67bd/tools/erp_agent_control/readonly_controller.py",
      "digest": "sha256:4eb7703d6834f27bf0a4558368ff392599c528fb266c41f08eab6fce0c71aff6",
      "classification": "SYNTHETIC_CANDIDATE"
    },
    {
      "locator": "git://d68ae7488135a715818578a0179a91a6d43e67bd/tools/erp_agent_control/tests/test_native_mvp.py",
      "digest": "sha256:7b2332c55ceb507688335ebbcf2a822e048be7fd28d47a0ebd23d1a6af91f652",
      "classification": "SYNTHETIC_TEST_EVIDENCE"
    },
    {
      "locator": "git://d68ae7488135a715818578a0179a91a6d43e67bd/tools/erp_agent_control/tests/test_readonly_controller.py",
      "digest": "sha256:ffa1204eb2ce848aa8109404759442e03180bb6f34fdd206a31606699addf7dc",
      "classification": "SYNTHETIC_TEST_EVIDENCE"
    }
  ],
  "forbidden_context": [
    "OWNER_UNTRACKED_INPUT",
    "PRODUCT_SOURCE",
    "GIT_INTERNALS",
    "REAL_BUSINESS_DATA",
    "SECRETS",
    "UAT_OR_PRODUCTION"
  ],
  "manifest_digest": "sha256:7cdbd212d9c95825dc6bc81eceeeb5351f81d9741f96ce6eebb3c25cf271859a"
}
